<?xml version="1.0" encoding="UTF-8"?>

<receta xmlns:xsi="http://www.w3.org/2001/XMLSchema-instance"
    xsi:noNamespaceSchemaLocation="ejemplo04.xsd">

    <medicamento>Paracetamol</medicamento>
    <medicamento>Omeprazol</medicamento>

    <farmacia>Farmacia Juaneda</farmacia>

    <edad>70</edad>

    <nombre>Francisco Santos</nombre>

    <pago>Gratuito</pago>

    <dni>10918186q</dni>

    <precio>16.51</precio>

    <medico numColegiado="171612713">Juan Ríos</medico>

    <posologia duracion="Cinco días">
        <tomas>3</tomas>
        <horario>Mañana, tarde y noche</horario>
    </posologia>

    <alergia />

    <grupo_sanguineo tipo="AB-" />

    <instrucciones>Esta medicación debe tomarse en <b>ayunas</b>. No <i>deben superarse</i> los <b>cuatro</b>
        comprimidos al día. </instrucciones>

</receta>